{
  "schema_version": "0.1",
  "manifest_id": "GEN-SHOP-EXAMPLE-001",
  "map_intent_ref": "MI-SHOP-EXAMPLE-001",
  "generator_ref": { "generator_id": "atlas-reusable-map-compiler", "version": "0.1.0" },
  "adapter_ref": null,
  "archetype_ref": { "archetype_id": "ARCH-INTERIOR-SHOP", "version": "1.0" },
  "layout_family_ref": { "layout_family_id": "LAY-INTERIOR-SHOP-BILATERAL", "version": "1.0", "variant_id": "single_aisle" },
  "style_pack_ref": { "style_pack_id": "STY-ASHFORD-COZY-INTERIOR", "version": "1.0" },
  "tile_palette_ref": null,
  "seed": {
    "algorithm": "sha256_truncated_64",
    "inputs": [
      "MI-SHOP-EXAMPLE-001",
      "ARCH-INTERIOR-SHOP@1.0",
      "LAY-INTERIOR-SHOP-BILATERAL@1.0",
      "single_aisle",
      "STY-ASHFORD-COZY-INTERIOR@1.0",
      "example-salt-shop-001"
    ],
    "salt": "example-salt-shop-001",
    "value": 17801666076276065200
  },
  "contract_version": "0.1",
  "generated_at": "2026-07-13",
  "output_map_plan_ref": null,
  "status": "generated_pending_review"
}
